{
  "schema_version": "2",
  "bundle": "runner",
  "version": "0.1.0-alpha.5",
  "components": {
    "operator": {
      "schema_version": "2",
      "component": "operator",
      "version": "0.1.0-alpha.5",
      "source": {
        "repository": "neohetj/operator",
        "commit": "c2c3b9ddb054057d831e797ad540deccb4ff4a68"
      },
      "artifacts": [
        {
          "platform": "darwin-amd64",
          "os": "darwin",
          "arch": "amd64",
          "filename": "operator_0.1.0-alpha.5_darwin_amd64",
          "url": "https://github.com/neohetj/evolution-releases/releases/download/operator-v0.1.0-alpha.5/operator_0.1.0-alpha.5_darwin_amd64",
          "sha256": "0411c96cc83476609bd7907708bf6433a4ad3e2405f9de8ad7c660df4515c97a"
        },
        {
          "platform": "darwin-arm64",
          "os": "darwin",
          "arch": "arm64",
          "filename": "operator_0.1.0-alpha.5_darwin_arm64",
          "url": "https://github.com/neohetj/evolution-releases/releases/download/operator-v0.1.0-alpha.5/operator_0.1.0-alpha.5_darwin_arm64",
          "sha256": "c83c2b483ff416b5a4137b999e489779c5ad46e035c0d5aca3978b4de83190f7"
        },
        {
          "platform": "windows-amd64",
          "os": "windows",
          "arch": "amd64",
          "filename": "operator_0.1.0-alpha.5_windows_amd64.exe",
          "url": "https://github.com/neohetj/evolution-releases/releases/download/operator-v0.1.0-alpha.5/operator_0.1.0-alpha.5_windows_amd64.exe",
          "sha256": "0f542d55d53266ca59489610685c6811bb8c9c40a31d7492d05150fdc678ac7c"
        }
      ]
    },
    "keymaker-runner-step": {
      "schema_version": "2",
      "component": "keymaker-runner-step",
      "version": "0.1.0-alpha.5",
      "source": {
        "repository": "neohetj/keymaker",
        "commit": "d214a677f4ab92e4b7435aa8339d2ae8e68af749"
      },
      "artifacts": [
        {
          "platform": "darwin-amd64",
          "os": "darwin",
          "arch": "amd64",
          "filename": "keymaker-runner-step_0.1.0-alpha.5_darwin_amd64",
          "url": "https://github.com/neohetj/evolution-releases/releases/download/keymaker-runner-step-v0.1.0-alpha.5/keymaker-runner-step_0.1.0-alpha.5_darwin_amd64",
          "sha256": "2ab855142665347ba5f6d8e080353e60b6085ee9a47684f4eb42e333d8a7571d"
        },
        {
          "platform": "darwin-arm64",
          "os": "darwin",
          "arch": "arm64",
          "filename": "keymaker-runner-step_0.1.0-alpha.5_darwin_arm64",
          "url": "https://github.com/neohetj/evolution-releases/releases/download/keymaker-runner-step-v0.1.0-alpha.5/keymaker-runner-step_0.1.0-alpha.5_darwin_arm64",
          "sha256": "432fa34d8921cd36f57208a82e2262e49ab44b37d8a98f6e1e065343b74a55ba"
        },
        {
          "platform": "windows-amd64",
          "os": "windows",
          "arch": "amd64",
          "filename": "keymaker-runner-step_0.1.0-alpha.5_windows_amd64.exe",
          "url": "https://github.com/neohetj/evolution-releases/releases/download/keymaker-runner-step-v0.1.0-alpha.5/keymaker-runner-step_0.1.0-alpha.5_windows_amd64.exe",
          "sha256": "329d445f558c3a6768e684be2dcc65b1586352c70c5c897cb24133deacfeb668"
        }
      ]
    }
  }
}
